{
  "slug": "hernieuwbare-elektriciteit-per-gemeente",
  "naam": "Hernieuwbare elektriciteit per gemeente",
  "leverancier": "klimaatmonitor",
  "thema": "opwek",
  "beschrijving": "Regionale uitsplitsing van landelijke cijfers over hernieuwbaar opgewekte elektriciteit, tot op gemeenteniveau. Onderdeel van de Regionale klimaatmonitor van RVO, waaruit je een selectie met de hand als CSV of Excel kunt exporteren. Frequentie, eenheid en startjaar zijn nog niet bij de bron bevestigd.",
  "frequentie": "jaar",
  "formaat": "Bestand",
  "toegang": "open",
  "sinds": 2010,
  "laatstGecontroleerd": "2026-10-23T09:49:00+02:00",
  "bronUrl": "https://klimaatmonitor.databank.nl/",
  "documentatieUrl": "https://klimaatmonitor.databank.nl/content/klimaatmonitor-api",
  "beperkingen": [
    "De Regionale klimaatmonitor wordt beheerd door de Rijksdienst voor Ondernemend Nederland (RVO). Noch de disclaimer, noch de gebruiksvoorwaarden van de Open Data Service noemen een licentie.",
    "RVO wijst aansprakelijkheid voor onjuiste of verouderde informatie af en stelt dat aan de datasets geen rechten kunnen worden ontleend.",
    "De gebruiksvoorwaarden van de Open Data Service richten zich op (decentrale) overheden, die de webservices vrij mogen gebruiken zolang ze de dienst niet overbelasten. Of hergebruik door anderen is toegestaan, staat er niet.",
    "Geautomatiseerd ophalen gaat via de Open Data Service, een JSON-API. Die vraagt een API-sleutel die je met naam, organisatie en mailadres via het contactformulier aanvraagt. De sleutel mag je niet delen.",
    "RVO vraagt applicaties de opgehaalde gegevens zelf op te slaan en niet rechtstreeks aan de Open Data Service te koppelen.",
    "De cijfers zijn een regionale uitsplitsing van landelijke registraties. Soms zijn ze identiek aan de landelijke cijfers, soms een deelverzameling of een verdeling daarvan over Nederland.",
    "Welke eenheid de indicator gebruikt en vanaf welk jaar de reeks loopt, staat niet op de openbare paginas van de monitor: het dashboard is alleen interactief te doorlopen. Die twee velden zijn niet bevestigd."
  ],
  "preview": {
    "enabled": false,
    "weergave": "staven"
  },
  "prompt": {
    "valkuilen": [
      "Gemeentelijke herindelingen maken een reeks over lange perioden lastig te vergelijken; controleer de gebiedsindeling per jaar.",
      "Controleer de eenheid in de export zelf voordat je rekent: de monitor gebruikt voor energie zowel TJ als kWh, afhankelijk van de indicator."
    ]
  },
  "zekerheid": "laag",
  "voorbeeld": true
}
