{
  "slug": "kleinverbruik-postcode-enexis",
  "naam": "Verbruiksdata kleinverbruikaansluitingen",
  "leverancier": "enexis",
  "thema": "verbruik",
  "beschrijving": "Standaardjaarafname van alle kleinverbruikaansluitingen in het verzorgingsgebied van Enexis Netbeheer, samengevoegd per postcodegebied. Per regel zijn minimaal tien aansluitingen samengevoegd. Naast de afname staan er percentages in over slimme meters, dubbel tarief en aansluitwaarde.",
  "frequentie": "jaar",
  "frequentieLabel": "jaarlijks, peildatum 1 januari",
  "formaat": "Bestand",
  "toegang": "open",
  "sinds": 2020,
  "eenheid": "kWh",
  "laatstGecontroleerd": "2026-10-28T08:25:00+01:00",
  "bronUrl": "https://www.enexis.nl/over-ons/waar-staan-wij-voor/open-data",
  "documentatieUrl": "https://www.enexis.nl/-/media/enexis-nl/pdf-documents/open-data/toelichtingkleinverbruiksgegevensopendataenexisnetbeheer.pdf",
  "licentie": {
    "naam": "CC0 1.0",
    "url": "https://creativecommons.org/publicdomain/zero/1.0/deed.nl"
  },
  "velden": [
    {
      "naam": "NETBEHEERDER",
      "type": "tekst",
      "betekenis": "EAN-code van de regionale netbeheerder"
    },
    {
      "naam": "NETGEBIED",
      "type": "tekst",
      "betekenis": "Aanduiding van het gesloten inkoopgebied waar de aansluiting onder valt"
    },
    {
      "naam": "STRAATNAAM",
      "type": "tekst",
      "betekenis": "Straatnaam; bij een samengevoegd cluster die van POSTCODE_VAN"
    },
    {
      "naam": "POSTCODE_VAN",
      "type": "tekst",
      "betekenis": "Postcode in het formaat vier cijfers en twee letters zonder spatie"
    },
    {
      "naam": "POSTCODE_TOT",
      "type": "tekst",
      "betekenis": "Gelijk aan POSTCODE_VAN, of de bovengrens van de postcodereeks als postcodes zijn samengevoegd"
    },
    {
      "naam": "WOONPLAATS",
      "type": "tekst",
      "betekenis": "Plaatsnaam; bij een samengevoegd cluster die van POSTCODE_VAN"
    },
    {
      "naam": "LANDCODE",
      "type": "tekst",
      "betekenis": "Landcode volgens ISO 3166 alpha-2, hier NL"
    },
    {
      "naam": "PRODUCTSOORT",
      "type": "tekst",
      "betekenis": "ELK voor elektriciteit of GAS voor gas"
    },
    {
      "naam": "VERBRUIKSSEGMENT",
      "type": "tekst",
      "betekenis": "KVB, het segment kleinverbruik"
    },
    {
      "naam": "AANSLUITINGEN_AANTAL",
      "type": "geheel getal",
      "betekenis": "Aantal aansluitingen in het postcodegebied voor deze energiesoort"
    },
    {
      "naam": "LEVERINGSRICHTING_PERC",
      "type": "percentage",
      "betekenis": "Percentage van de aansluitingen met netto afname; dit daalt als er meer wordt teruggeleverd"
    },
    {
      "naam": "FYSIEKE_STATUS_PERC",
      "type": "percentage",
      "betekenis": "Percentage van de aansluitingen dat in bedrijf is"
    },
    {
      "naam": "SOORT_AANSLUITING_PERC",
      "type": "percentage",
      "betekenis": "Percentage van de meest voorkomende aansluitwaarde"
    },
    {
      "naam": "SOORT_AANSLUITING",
      "type": "tekst",
      "betekenis": "Naam van de meest voorkomende aansluitwaarde, bijvoorbeeld 1x25 of G6"
    },
    {
      "naam": "SJA_GEMIDDELD",
      "type": "getal",
      "betekenis": "Gemiddelde standaardjaarafname, in kWh bij elektriciteit en in kubieke meter bij gas"
    },
    {
      "naam": "SJA_LAAG_TARIEF_PERC",
      "type": "percentage",
      "betekenis": "Percentage van de aansluitingen met een dubbel tarief"
    },
    {
      "naam": "SLIMME_METER_PERC",
      "type": "percentage",
      "betekenis": "Percentage slimme meters, alle generaties samen"
    }
  ],
  "beperkingen": [
    "Enexis stelt deze dataset niet als directe download beschikbaar op de eigen site: je vraagt hem aan via een formulier. In de landelijke catalogus data.overheid.nl staan de CSV-bestanden wel rechtstreeks.",
    "De registratie van Enexis in data.overheid.nl noemt CC0 1.0 als licentie. Op de eigen open-datapagina schrijft Enexis alleen dat je de datasets vrij mag gebruiken, zonder een licentie te noemen, en verwijst het naar de disclaimer.",
    "Het startjaar is niet gedocumenteerd. De catalogus data.overheid.nl biedt de peildatums 1 januari 2020, 2021 en 2022. Het veld sinds staat daarom op de vroegste gepubliceerde peildatum.",
    "Enexis biedt op de eigen site bij sommige sets historische data aan, tot maximaal drie jaar terug. Welke peildatums dat nu zijn, staat er niet bij.",
    "Voor oudere jaren verwijst Enexis naar Partners in Energie.",
    "De registratie in data.overheid.nl is sinds 31 januari 2023 niet bijgewerkt; nieuwere peildatums staan er niet in. Het veld laatstBijgewerkt staat op die datum, terwijl de nieuwste peildatum in de registratie 1 januari 2022 is.",
    "Per regel zijn minimaal tien aansluitingen samengevoegd. Bij minder dan tien worden postcodes samengevoegd en staat de bovengrens van de reeks in POSTCODE_TOT.",
    "De standaardjaarafname is de verwachte jaarafname bij gestandaardiseerde condities, niet het gemeten verbruik. Bij een draaistroommeter is de afname gesaldeerd.",
    "Sinds 14 maart 2022 heet standaardjaarverbruik (SJV) in de toelichting standaardjaarafname (SJA), na een besluit van de ACM."
  ],
  "preview": {
    "enabled": false,
    "weergave": "staven"
  },
  "prompt": {
    "valkuilen": [
      "Het bestand is gescheiden met tab-tekens, tekstvelden staan tussen aanhalingstekens en het decimaalteken is een komma.",
      "SJA_GEMIDDELD staat in kWh bij elektriciteit en in kubieke meters bij gas; filter eerst op PRODUCTSOORT.",
      "Een regel kan meer dan een postcode beslaan; vergelijk POSTCODE_VAN met POSTCODE_TOT voordat je per postcode rekent."
    ]
  },
  "zekerheid": "midden",
  "laatstBijgewerkt": "2023-01-31"
}
