{
  "slug": "opwek-wind-op-zee",
  "naam": "Opwek wind op zee",
  "leverancier": "ned",
  "thema": "opwek",
  "beschrijving": "Opwek van de Nederlandse windparken op zee, landelijk en per windpark. Het Nationaal Energie Dashboard modelleerde deze reeks aanvankelijk zelf en neemt nu de bemeten gegevens over van het transparantieplatform ENTSO-E; de uitsplitsing per windpark en de voorspelling blijven gemodelleerd.",
  "frequentie": "kwartier",
  "frequentieLabel": "instelbaar van 10 minuten tot jaar",
  "formaat": "API",
  "toegang": "account",
  "sinds": 2016,
  "eenheid": "kW",
  "laatstBijgewerkt": "2026-10-23",
  "laatstGecontroleerd": "2026-10-23T09:49:00+02:00",
  "bronUrl": "https://ned.nl/nl/dataportaal/energie-productie/elektriciteit/windenergie-op-zee",
  "documentatieUrl": "https://ned.nl/nl/datacatalogus",
  "licentie": {
    "naam": "Vrij te gebruiken met bronvermelding, volgens de datasetpagina van ned.nl",
    "url": "https://ned.nl/nl/dataportaal/energie-productie/elektriciteit/windenergie-op-zee"
  },
  "velden": [
    {
      "naam": "validfrom",
      "type": "datum-tijd",
      "betekenis": "Begin van het interval waarover de waarde geldt"
    },
    {
      "naam": "validto",
      "type": "datum-tijd",
      "betekenis": "Einde van het interval waarover de waarde geldt"
    },
    {
      "naam": "capacity",
      "type": "getal",
      "betekenis": "Opgewekt vermogen in kW"
    },
    {
      "naam": "volume",
      "type": "getal",
      "betekenis": "Opgewekt volume in kWh"
    },
    {
      "naam": "percentage",
      "type": "getal",
      "betekenis": "Benutting als percentage van het totaal geinstalleerde vermogen"
    },
    {
      "naam": "point",
      "type": "verwijzing",
      "betekenis": "Het gebied waar de waarde over gaat: Nederland als geheel of een afzonderlijk windpark op zee"
    },
    {
      "naam": "type",
      "type": "verwijzing",
      "betekenis": "De energiedrager; voor wind op zee zijn er drie typen, 17 WindOffShore, 22 WindOffshoreB en 51 WindOffshoreC"
    },
    {
      "naam": "granularity",
      "type": "verwijzing",
      "betekenis": "De tijdstap: 10 minuten, kwartier, uur, dag, maand of jaar"
    },
    {
      "naam": "granularitytimezone",
      "type": "verwijzing",
      "betekenis": "De tijdzone van de tijdstap: UTC of Europe/Amsterdam"
    },
    {
      "naam": "classification",
      "type": "verwijzing",
      "betekenis": "Soort waarde; op dit moment alleen near-realtime"
    },
    {
      "naam": "lastupdate",
      "type": "datum-tijd",
      "betekenis": "Wanneer het record voor het laatst is bijgewerkt"
    }
  ],
  "beperkingen": [
    "De datacatalogus kent drie typen voor wind op zee: 17 WindOffShore met de uitsplitsing per windpark, 22 WindOffshoreB voor co2monitor.nl en 51 WindOffshoreC voor ned.nl. De keuze bepaalt de uitkomst.",
    "De uitsplitsing per windpark is gemodelleerd, ook waar het landelijke totaal op bemeten ENTSO-E-gegevens berust.",
    "Voor de API en de downloads is een gratis account op ned.nl nodig; de sleutel maak je zelf aan onder mijn account. Deel de sleutel niet met anderen.",
    "De algemene voorwaarden van ned.nl verbieden in artikel 3.6 het kopieren, distribueren of doorverkopen aan derden zonder toestemming. De datasetpagina staat hergebruik met bronvermelding wel toe.",
    "De oude endpoint api.netanders.io/v1 is niet langer in gebruik; gebruik api.ned.nl/v1.",
    "Naast de gerealiseerde opwek publiceert ned.nl een voorspelling voor zeven dagen vooruit. Die houdt rekening met het terugregelen van windparken bij storm en wordt verlaagd bij een negatieve day-ahead prijs."
  ],
  "preview": {
    "enabled": false,
    "weergave": "weefsel"
  },
  "prompt": {
    "valkuilen": [
      "Kies bewust een granularitytimezone: UTC en Europe/Amsterdam geven rond de zomertijdwissel een andere dagindeling.",
      "capacity is een vermogen in kW en volume een hoeveelheid in kWh. Tel capacity niet op over tijdstappen alsof het energie is.",
      "Tel de drie typen voor wind op zee niet bij elkaar op: het zijn drie varianten van dezelfde opwek, geen aparte parken.",
      "De reeks loopt vanaf 2016, maar het geinstalleerde vermogen op zee is sindsdien sterk gegroeid. Zet een jaarvergelijking af tegen het vermogen, niet tegen de absolute opwek alleen."
    ]
  },
  "zekerheid": "midden"
}
